<?xml version="1.0" encoding="utf-8"?>
<!DOCTYPE article SYSTEM "../finkdoc.dtd">

<article filename="index" lang="en" fsroot="../../">
<title>Fink CVS アクセスを設定</title>
<shorttitle>Fink CVS アクセス</shorttitle>
<cvsid>$Id: cvs.ja.xml,v 1.1 2009/10/17 05:34:29 babayoshihiko Exp $</cvsid>

<preface>
<p>
Fink は CVS を用いて開発されています。 すなわち、リリース前にも、つねに最新の状態でいることができます。 このページでは、すでに Fink をインストールしている方を対象に、CVS での更新方法をお伝えいたします。 ここの情報は、 Fink 0.3.x 以降で有効です。
</p>
</preface>


<section><title>Fink CVS の構造</title>
<p>
Fink には、いくつかの CVS モジュールがあります。
<code>dists</code> (<link
url="http://fink.cvs.sourceforge.net/fink/">ViewCVS</link>)
モジュールには、OS X 10.2 以降のパッケージ記述ファイルとパッチが格納されています。
この他にも Fink 開発者によって使われているモジュールがあり、
誰でも見ることができますが、
おそらくほとんどのユーザーには関心がないことでしょう。
</p>
</section>

<section><title>パッケージ記述の更新</title>
<p>
以前は、これはちょっと手間のかかることでした。
しかし、現在の Fink では、とてもシンプルです。
以下のコマンドを実行してください。
</p>
<codeblock>fink selfupdate-cvs</codeblock>
<p>
あとは Fink が、必要なステップを自動的に行います。
これにより、最新のパッケージ記述の取得と必須コアパッケージ (Fink パッケージマネージャーを含む) の更新が行われます。
</p>
<p>
ファイアーウォールの内側にいる場合、
<link url="http://www.finkproject.org/faq/usage-fink.php#proxy">FAQ 3.2</link>
をご参考にしてください。
</p>
<p>
この方法でパッケージ記述を更新し、
インストール済みのパッケージを最新バージョンに更新したい場合、
以下のコマンドで行うことができます。
</p>
<codeblock>fink update-all</codeblock>
</section>

<section><title>パッケージマネージャーの更新</title>
<p>
<em>注記:</em> 2001年9月20日より、
パッケージマネージャーを個別に更新する必要はなくなりました。
他のパッケージと全く同様に行うことができます。
今でも CVS から直接更新することは可能ですが、
これはパッケージ制作者のためのもので、
一般ユーザーにはあまり関係ないことでしょう。
</p>

<p>The package manager must be updated through a separate directory
and the <code>inject.pl</code> script. That script puts package
descriptions and tarballs for the fink and base-files packages in your
Fink tree and builds them.
パッケージマネージャーは、独立したディレクトリを通して、
 <code>inject.pl</code> スクリプトで更新しなければなりません。
</p>
<p>
初めての場合、仮ディレクトリ（ここでは <code>tempdir</code> とする）が必要です。
これは空でなくてはいけません (あるいは少なくとも fink という名のサブディレクトリがあってはいけない)。
これは、その後、このようになります。
</p>
<codeblock>cd tempdir
cvs -d:pserver:anonymous@fink.cvs.sourceforge.net:/cvsroot/fink login
cvs -z3 -d:pserver:anonymous@fink.cvs.sourceforge.net:/cvsroot/fink co fink
cd fink
./inject.pl</codeblock>
<p>
ログインコマンドは、パスワードを尋ねてきます。
何も入力せずリターンキーを押してください。
この語、仮ディレクトリは削除してもかまいません。
ただし、残しておくと次回から更新が容易になります。
次回からは、
</p>
<codeblock>cd tempdir/fink
cvs -z3 update -d
./inject.pl</codeblock>
</section>

</article>
