<?xml version="1.0" encoding="utf-8"?>
<!DOCTYPE article SYSTEM "../finkdoc.dtd">
<article filename="readme" lang="ru">
    <title>Ознакомительный файл Fink</title>
    <shorttitle>Ознакомительный файл</shorttitle>
    <cvsid>$Id: readme.ru.xml,v 1.3 2012/11/11 15:20:15 gecko2 Exp $</cvsid>
    <preface>
        <p> Система управления пакетами Fink предназначена для переноса
            всего мира ПО с открытым исходным кодом в Darwin и Mac OS X.</p>
        <p> При помощи dpkg она поддерживает отдельную иерархию каталогов.
            Fink скачивает версии оригинального исходного кода, при необходимости делает в них патчи,
            конфигурирует эти версии для Darwin, затем компилирует и инсталлирует.
            Информация об имеющихся пакетах и необходимых патчах
            ("описание пакетов") поддерживается отдельно, но обычно входит
            в состав дистрибуции. Реальный исходный код скачивается
            по мере необходимости из Internet.</p>
        <p> Хотя Fink не может считаться "зрелой" системой и имеет определенные жесткие ограничения
            и недостающие параметры, она успешно используется большим количеством людей.
            Просим внимательно прочитать инструкции и не удивляться, если
            что-то будет работать не так, как вы ожидали. Для большинства
            сбоев существует обоснованное объяснение; если потребуется помощь, посетите наш веб-сайт.</p>
        <p> Fink выпускается на условиях Общей публичной лицензии GNU.
            См. файл COPYING для получения более подробной информации.</p>
    </preface>
    <section name="req">
        <title>Требования</title>
        <p> Вам необходимо иметь следующее:</p>
        <ul>
            <li>
                <p> Инсталлированная система Mac OS X, версия 10.0 или более поздняя. (Иногда
                    все еще могут возникать проблемы с 10.1 из-за компоновщика.)
                    Darwin 1.3.1 также должна работать, но это не проверено.
                    Более ранние версии обеих систем <em>не</em> будут работать.</p>
            </li>
            <li>
                <p> Компакт-диск инструментов разработки. Надо инсталлировать пакет Developer.pkg в Mac OS X с компакт-диска Developer Tools.
                    Надо убедиться, что инсталлируемые вами инструменты соответствуют версии вашей Mac OS X. В Darwin
                    инструменты уже есть по умолчанию после инсталляции. </p>
            </li>
            <li>
                <p> Доступ в Internet. Весь исходный код скачивается с зеркальных сайтов.</p>
            </li>
            <li>
                <p> Терпение. Компиляция нескольких больших пакетов занимает время. Я в это время
                    болтаю часами и даже днями.</p>
            </li>
        </ul>
    </section>
    <section name="install">
        <title>Инсталляция</title>
        <p>Процесс инсталляции подробно описан  в файле "Инсталляция".
            Просим сначала ознакомиться с текстом, т.к. процесс необычен. Здесь же описывается процедура
            обновления.</p>
    </section>
    <section name="usage">
        <title>Использование Fink</title>
        <p> Файл "Использование" описывает, как настраивать маршруты, инсталлировать и
            удалять пакеты. Кроме того, он включает полный список имеющихся команд.</p>
    </section>
    <section name="questions">
        <title>Другие вопросы?</title>
        <p> Если в предлагаемой документации нет ответа на ваш вопрос,
            перейдите с веб-сайта Fink на <link
            url="/">/</link>
            и посмотрите там страницу Help:<link
            url="/help/">/help/</link>.
            На ней вы найдете сведения обо всей другой имеющейся документации и источниках
            необходимой вам поддержки.</p>
        <p> Если вы хотите внести свой вклад в развитие Fink,  вышеуказанная страница Help также
            содержит список того, что вы можете сделать - например, тестирование или создание пакетов.</p>
    </section>
    <section name="uptodate">
        <title>Регулярное получение информации</title>
        <p> Адрес веб-сайта проекта: <link url="/">/</link>.</p>
        <p> Для регулярного получения информации о новых версиях можно подписаться на список рассылки fink-announce на <link
            url="/lists/fink-announce.php">/lists/fink-announce.php</link>.
            Это умеренный список с низким уровнем трафика.
            </p>
    </section>
</article>
