<?xml version="1.0" encoding="utf-8"?>
<!DOCTYPE article SYSTEM "../finkdoc.dtd">
<article filename="index" lang="ru" fsroot="../../">
    <title>Настройка доступа к Fink через CVS</title>
    <shorttitle>Доступ к Fink через CVS</shorttitle>
    <cvsid>$Id: cvs.ru.xml,v 1.2 2006/02/28 02:44:45 alexkhansen Exp $</cvsid>
    <preface>
        <p> Fink разработан через посредство CVS. Это значит, что вы можете быть в курсе 
         последних разработок между выпусками версий и всегда получать новейший материал. Данная страница рассказывает о том, 
           как можно произвести настройку имеющейся инсталляции Fink для обновления через 
            CVS. Информация на данной странице относится к Fink 0.3.x и более поздним версиям.</p>
    </preface>
    <section>
        <title>Структура CVS Fink </title>
        <p>Fink имеет несколько модулей CVS. Модуль <code>dists</code> (<link
            url="http://cvs.sourceforge.net/viewcvs.py/fink">ViewCVS</link>)
            содержит описание пакетов и патчи для OS X 10.2 и более поздних версий. Есть другие модули, используемые разработчиками Fink,  
            обзор которых доступен всем, но они не представляют интереса для большинства пользователей.</p>
    </section>
    <section>
        <title>Обновление описания пакетов</title>
        <p>Раньше это была довольно нудная процедура, но в текущих версиях Fink
            это очень просто. Просто дайте следующую команду:</p>
        <codeblock>fink selfupdate-cvs</codeblock>
        <p>Fink автоматически выполнит все необходимые вам действия, в том числе  
            найдет последний комплект описания пакетов и обновит несколько основных базовых пакетов 
            (среди них менеджер пакетов Fink).</p>
        <p>Если вы находитесь за брандмауэром, см. <link
                url="http://fink.sourceforge.net/faq/usage-fink.php#proxy">Ч.З.В. 3.2</link>.</p>
        <p>После обновления своего описания пакетов указанным образом у вас 
            может появиться желание обновить свои пакеты до последних возможных версий. 
            Это можно сделать при помощи следующй команды:</p>
        <codeblock>fink update-all</codeblock>
    </section>
    <section>
        <title>Обновление менеджера пакетов</title>
        <p>
            <em>Примечание:</em>С 20 сентября 2001 н. больше нет необходимости 
            обновлять менеджер пакетов отдельно; с ним обращаются, как с любым другим 
            пакетом. Все еще возможно обновлять его непосредственно из CVS, хотя
            это обычно интересует тех, кто создает пакеты, а не средних
            пользователей.</p>
        <p>Менеджер пакетов должен обновляться через отдельный каталог и
            скрипт <code>inject.pl</code>. Данный скрипт помещает описание 
            пакетов и тарболы для пакетов fink и базовых файлов 
            на вашем дереве Fink и осуществляет их построение.</p>
        <p>При выполнении первоначальной процедуры вам нужен временный каталог (в примере называемый 
            <code>tempdir</code>), который должен быть пустым (или по крайней мере не должен содержать
            подкаталог под именем 'fink'). Порядок действий 
            следующий:</p>
        <codeblock>cd tempdir cvs
            -d:pserver:anonymous@cvs.sourceforge.net:/cvsroot/fink login cvs -z3
            -d:pserver:anonymous@cvs.sourceforge.net:/cvsroot/fink co fink cd
            fink ./inject.pl</codeblock>
        <p>Команда login запросит пароль - просто нажмите return. Вы
            можете удалить временный каталог после данной процедуры, но если
            его оставить, будет легче произвести обновление в следующий раз. Тогда порядок действий таков:</p>
        <codeblock>cd tempdir/fink cvs -z3 update -d ./inject.pl</codeblock>
    </section>
</article>
