<?xml version="1.0" encoding="UTF-8"?>
<!DOCTYPE article SYSTEM "../finkdoc.dtd">
<article filename="index" lang="es" fsroot="../../">
  <title>Ajustando el Acceso al CVS de Fink</title>
  <shorttitle>Acceso al CVS de Fink</shorttitle>
  <cvsid>$Id: cvs.es.xml,v 1.8 2012/11/11 15:20:13 gecko2 Exp $</cvsid>
  <preface>
    <p>
Fink es desarrollado mediante CVS.
Esto significa que puedes mantenerte al día entre las liberaciones del Fink y siempre tener lo ultimo.
Esta página le explicará como ajustar una instalacion existente de Fink para que se actualice mediante el CVS.
La informacion de esta pagina aplica al Fink 0.3.x y posterior.
</p>
  </preface>
  <section>
    <title>Estructura del CVS de Fink</title>
    <p>Fink posee varios módulos de CVS. El módulo <code>dists</code> (<link url="http://fink.cvs.sourceforge.net/fink/">ViewCVS</link>)
contiene las descripciones de los paquetes y parches para OS 10.2 y posterior. Existen otros módulos usados por los desarrolladores de Fink, los cuales cualquiera puede ver, pero no son muy interesantes para la mayoría de los usuarios.</p>
  </section>
  <section>
    <title>Actualizando las Descripciones de los Paquetes</title>
    <p>Antes, esto era muy tedioso; pero en las versiones recientes de Fink es muy simple. Solo ejecuta este comando:
</p>
    <codeblock>fink selfupdate-cvs</codeblock>
    <p>Fink ejecutara todos los pasos necesarios automaticamente. Esto incluye conseguir las descripciones más recientes delos paquetes, actualizando los paquetes esenciales (entre ellos, el manejador de paquetes del Fink).
</p>
    <p>Si estas tras un firewall, consulta el <link url="/faq/usage-fink.php#proxy">FAQ 3.2</link>.
</p>
    <p>Despues de que se hayan actualizado las descripciones de los paquetes de esta manera, puedes actualizar los paquetes a sus últimas versiones. Esto se realiza ejecutando el comando:
</p>
    <codeblock>fink update-all</codeblock>
  </section>
  <section>
    <title>Actualizando el Manejador de Paquetes</title>
    <p>
<em>Nota:</em> A partir del 20 de Septiembre del 2001, ya no es necesario actualizar el manejador de paquetes independientemente; ahora es como cualquier paquete. Aún es posible actualizar directamente del CVS, aunque esto sólo es útil para la gente creando paquetes, no para el usuario promedio.  
</p>
    <p>El manejador de paquetes debe ser actualizado a través de un directorio separado y con el script<code>inject.pl</code> Este script pone las descripciones del paquete asi como los archivos tar para el fink y los archivos-bases en tu directorio Fink y entonces los construye.c</p>
    <p>Para ejecutar esto por primera vez, necesitaras un directorio temporal (llamado <code>tempdir</code> en el ejemplo) el cual esta vacío (o por lo menos que no tenga un subdirectorio llamado  'fink'). El procedimiento es como sigue:</p>
    <codeblock>cd tempdir
cvs -d:pserver:anonymous@fink.cvs.sourceforge.net:/cvsroot/fink login
cvs -z3 -d:pserver:anonymous@fink.cvs.sourceforge.net:/cvsroot/fink co fink
cd fink
./inject.pl</codeblock>
    <p>Este comando de login solicitará un password - presiona return y continua. El directorio temporal puede ser eliminado una vez que el proceso haya concluido, pero si no lo haces asá, la siguiente vez que actualices sera más fácil. El procedimiento entonces será:</p>
    <codeblock>cd tempdir/fink
cvs -z3 update -d
./inject.pl</codeblock>
  </section>
</article>
