<?xml version="1.0" encoding="utf-8"?>
<!DOCTYPE article SYSTEM "../finkdoc.dtd">

<article filename="readme" lang="ja">
<title>Fink ReadMe</title>
<shorttitle>ReadMe</shorttitle>
<cvsid>$Id: readme.ja.xml,v 1.4 2012/11/11 15:20:15 gecko2 Exp $</cvsid>

<preface>
<p>
Fink は Open Source ソフトウェアを Darwin と Mac OS X　で使えるようにすることを目的としたパッケージ管理システムです。
</p>
<p>
dpkg を使うことで、独立したディレクトリハイエラルキーを保ってるシステムです。
主な機能として、元となるソースリリースをダウンロード、必要に応じたパッチ当て、 Darwin 用の configure 、コンパイル、インストールを行います。
利用可能なパッケージと必要なパッチの情報 ("パッケージ詳細") は別々に管理され、通常この配布に含まれています。
実際のソースコードは必要に応じてインターネットからダウンロードされます。
</p>
<p>
Fink はまだ荒削りで機能不足なため「成熟」した状態にあるとは言えませんが、既に多くの人々に使われています。
使用方法をよく読み、たとえうまくいかなくても驚かないでください。
多くの問題は既に分析されていて、ウェブサイトに情報があります。
</p>
<p>
Fink は GNU General Public License の下で配布されています。
詳細は COPYING ファイルをご覧ください。
</p>
</preface>

<section name="req"><title>動作条件</title>
<p>
以下が必要です:
</p>
<ul>
<li><p>
インストール済み Mac OS X システム、バージョン 10.0 以降。
(10.1 にリンカ関連の問題が多少残っています)
Darwin 1.3.1 も動作すると思われますが、テストはされていません。
これより前のバージョンは<em>動作しません</em>。
</p></li>
<li><p>
開発ツール。
Mac OS X では Developer Tools CD から Developer.pkg パッケージをインストールして下さい。
このツールは Mac OS X バージョンに対応している必要があります。
Darwin では、デフォルトインストールでツールが揃っているはずです。
</p></li>
<li><p>
インターネットへの接続。
すべてのソースコードはミラーサイトからダウンロードされます。
</p></li>
<li><p>
忍耐。
コンパイル、特に大きなパッケージには時間がかかります。
数時間から数日かかることもあります。
</p></li>
</ul>
</section>

<section name="install"><title>インストール</title>
<p>
インストール方法は INSTALL ファイルに書かれています。
インストール方法は簡単ではないので、これを最初にお読みください。。
また、アップグレード方法も書かれています。
</p>
</section>

<section name="usage"><title>Fink の使用方法</title>
<p>
USAGE ファイルにパスの通し方やパッケージのインストールや削除方法が書かれています。
また、コマンド一覧も書かれています。
</p>
</section>

<section name="questions"><title>質問?</title>
<p>
If the documentation included here doesn't answer your question,
stroll over to the Fink website at
もしここにあるドキュメントで質問に答えていない場合、 Fink ウェブサイト
<link url="/">/</link>
に来て、ヘルプページを参照してください:
<link url="/help/">/help/</link> 。
ここにほかのドキュメントやサポートの得られる場所についての情報が書かれています。
</p>
<p>
Fink に貢献をしたい場合、上記のヘルプページに、テストやパッケージ作成など、現在募集している内容一覧があります。
</p>
</section>

<section name="uptodate"><title>告知</title>
<p>
当プロジェクトのウェブサイトは
<link url="/">/</link>
です。
</p>
<p>
新しいリリースの情報は、
<link url="/lists/fink-announce.php">/lists/fink-announce.php</link>
から fink-announce メーリングリストを購読してください。
このリストは受信専用で、トラフィック量は小さいです。
</p>
</section>

</article>
